date,title,url,president,text_category,full_text
"May 21, 1996",Remarks at the Funeral Service for Admiral Jeremy M. Boorda,https://www.presidency.ucsb.edu/documents/remarks-the-funeral-service-for-admiral-jeremy-m-boorda,William J. Clinton,eulogy,"Mrs. Boorda, Mike's family, Secretary Christopher and our friends from the diplomatic corps, Secretary Perry, Secretary Dalton, General Shalikashvili, members of the Joint Chiefs of Staff, unified commanders in chief, the leadership and Members of Congress who are here, Admiral Johnson and the flag leadership of our Navy, Master Chief Petty Officer of the Navy Hagan, to our great Navy sailors and all of America's Armed Forces. Today we come to honor and give thanks for the life of Mike Boorda, a special man who earned a special place in the heart of his Navy and the heart of our Nation. He lived a life that makes America proud, beginning, of course, with his family. His first words upon becoming Chief of Naval Operations were, ""I wouldn't be here if it wasn't for Bettie, and I wouldn't want to be here without her.""
To Bettie and David and Edward and Anna, your families, I know there is nothing we can say or do to ease the loss of your husband and father and grandfather. I hope you find comfort in the love and respect and honor that surrounds you today, here in this great cathedral and all throughout our great land. I thank you for your service to the Navy. I thank you, Bettie. I thank you, Edward and Robert, for your service. I thank you, David, for your work on the radio. I thank you, Anna, for your devotion and for your husband's service, and Edward, for your wife's service. But your entire family is a model, a reflection of Mike Boorda's remarkable love for the Navy, a Navy in which he enlisted when he was just 16.
When he was first in his class at personnelman school in San Diego, he was offered his choice of assignments. Displaying his characteristic compassion, he traded the slot with a friend whose wife was sick and expecting a baby. So the friend got to stay in San Diego, and Mike got shipped to Oklahoma. Oklahoma's coastline leaves something to be desired for people designing a career in the Navy. But it turned out to be a first-rate assignment because that's where he met Bettie.
He was commissioned an officer in 1962. Then his star rose fast and bright with important assignments, from weapons officer aboard destroyers to Chief of Naval Personnel to commander in chief of our Naval forces in Europe and CINC of the Southern Command. And as all of you know, 2 years ago just last month, he became the very first enlisted man in the entire history of the United States Navy to be the Chief of Naval Operations.
At every turn he led in helping us, our country, live up to its responsibilities as the world's leading force for freedom. He served two tours of duty in Southeast Asia. As has been said today, as commander in chief of Allied Forces in Southern Europe, he ordered the first offensive action in NATO's history, the strikes against Bosnian Serb aircraft violating the no-fly zone.
I know his family is especially proud of the role he played and the role that they supported in getting food and relief to the war-torn people of Bosnia. I very much want history to record that Mike Boorda's quiet determination to do all we could do to end the slaughter of the children and the innocents in Bosnia and to bring that awful war to an end had a profound impact on his President and on the policy of this Nation.
Even after he became Chief of Naval Operations, I continued to ask him what he thought we should do to get a reality check on the rest of the advice I was given. And I want to say to all of you what I said to his family this last weekend. It is my belief that perhaps more than any other military officer in this country, Mike Boorda helped to lead us to the point of peace at Dayton. And there are countless thousands of people alive in Bosnia today because of this small man with a big heart, a large vision, and great courage.
He developed new strategies to carry our Navy into the 21st century. He spearheaded projects like theater ballistic missile defense and the arsenal ship that have put our Navy on the cutting edge of technology.
Like all great sailors, he loved the sea, and he loved sea stories. The stories about him are legion and now legend. I'm told that when I nominated him to be the Chief of Naval Operations, he called his mother, Trudy Wallace, from Italy to tell her that he was about to become the CNO. She asked if it was a promotion.
He said, ""No, I'm already a four-star admiral."" She asked if he were going to get a raise. He said, ""No, I'll be making a little less; I'm losing my overseas living allowance."" She then said, ""Well, surely you'll get a bigger house."" And he said, ""Actually, it will be smaller than the Mediterranean villa we have now."" Apparently, his mother then said, ""Well, don't you have enough time in to retire?"" [ Laughter ] Now, every family has got a story like that. Well, he didn't get a raise or a promotion or a bigger house, but he got a bigger job, and he did his mother and his family and his country proud.
Many have said before me that his lasting legacy will be his concern for the sailors. He knew the people were the Navy's greatest asset. And every day he made the Navy stronger because he took good care of its sailors. He loved the bluejackets, and he loved the officers. When he came on board a ship or entered a room of sailors, you could see the twinkle in his eye. Without ever ranting or reprimanding, criticizing or cajoling, he found a way to bring out the best of everyone, seaman or admiral, boatswain mate to battle group commander. Talk to him for just a few moments, and you couldn't help but like him; you couldn't help but love our Navy even more and want to do the best you could for our country.
He also understood that beyond the things that he fought for that were material for our men and women in uniform, beyond the better housing, the better pay, the better time at home with families, there was, above all, the importance of caring and compassion. Last year in Norfolk, he spoke to a theater full of sailors. The chief machinist mate nervously stepped up to the microphone and explained his predicament. His wife had recently passed away, and he was left with two young daughters. He told the CNO that he had 6 months before his retirement date, but he would have to reenlist before then, and that meant more sea duty and separation from his children. Right there at the mike, the CNO asked, ""So you want to retire in June?"" The MMC meekly replied, ""Yes, sir."" And right then and there, Admiral Boorda said, ""Your request is approved. We'll work it out.""
The Admiral used to joke about being small in stature. Shortly after I named him Chief of Naval Operations, we were in the English Channel together, celebrating the 50th anniversary of the Normandy invasion on the aircraft carrier the George Washington. And I spoke just as I am now, but I had the Presidential lectern there. And when I finished, he was coming up, so I pulled out the stand for him to stand on. And he got up, and he looked at me, and he said, ""You know, this is the second time you've elevated me in the last couple of months."" [ Laughter ]
Well, that's the kind of sense of honor he had. Even though he was very small, the rest of us always looked up to him, looked up to his ability somehow to inspire us all to do better, to reach beyond ourselves.
There was reported in the press a Navy photographer's remarks I would like to repeat who said, ""Everyone was always asking me to take photos with him. They wanted to stand next to the best thing the Navy had.""
Before I came over here today, I visited the Pentagon. And I went to the Navy Command Center to the briefing room that Admiral Boorda began his day in several times a week to thank the staff who worked with him every day and who can't be with us here today because they're on duty, as he would want them to be. And they were encouraged to tell me whatever they want. I thought you might be interested to know what those people who are now over at the Pentagon, doing the work they did every day for Mike Boorda, had to say to me.
One said, ""There's a $5 bill over there on the wall. Do you see it, Mr. President?"" I said, ""Yes, I did."" He said, ""That's the bet the Admiral had with the weatherman every time we had a briefing. He always bet against the weatherman. And as of the last bet, he was $5 ahead."" Another said that every time there was a briefing in the morning, he brought in strips of bacon and literally shoved bacon at everyone else. He was always trying to share his bacon and make people laugh about it. A third said that the thing that meant the most to her was that at Christmastime he literally greeted every single sailor in the Pentagon. No matter how much time it took, that's what he did.
A young sailor in the office said that the thing that moved her most was that she handled his correspondence, and he would never let her send a form letter. Even when someone wrote to him and went outside the chain of command, he would write a gentle letter back explaining what the chain of command was. But it was always a personal letter, so that the young sailor who wrote would know that the CNO really cared and really read the letter.
And finally, one very large African-American sailor from the State of Tennessee stood up in the back of the room, and he said, ""Mr. President, how can we ever replace this man?""
In the Bible there is the great story of two warriors and friends, David and Jonathan. When they prepared to part, Jonathan said, ""Tomorrow there is a new Moon, and thou shalt be missed, because thy seat will be empty."" Mike Boorda's seat is empty, and how we shall miss his warm smile, his easy manner, his wonderful voice, his sharp wit. What a legacy he has left behind: his ferocious devotion to all of you; his commitment to give all of you a chance to be the very best that you can be, to give our country its chance for true greatness; his deep sense of honor, which no person should ever question.
Now Mike Boorda's ship is moored. His voyage is complete. But I know when the whistle blew and the colors were shifted, he was welcomed on the pier by God's loving, eternal embrace. May God bless and cherish Admiral Mike Boorda as he blessed and cherished our lives and our beloved America."
"April 10, 1996",Remarks at the Funeral of Secretary of Commerce Ronald H. Brown,https://www.presidency.ucsb.edu/documents/remarks-the-funeral-secretary-commerce-ronald-h-brown,William J. Clinton,eulogy,"Ladies and gentlemen, fellow Americans, citizens of the world who have come here; to Alma and Tracey and Michael and Tammy; to Chip and to Ron's mother and to the other members of the family who are here: This has been a long week for all of us who loved Ron Brown, cared for his work, cherished the brilliant young people who worked with him, honored the business executives who took the mission of peace to Bosnia, and the members of our United States military who were taking them on that mission.
But this has been the longest week for the Brown family. You have grieved and wept. You have comforted others whose loved ones were lost. You have remembered and smiled, and last evening you got to celebrate and laugh at the life that you shared, each in your own way, with Ron.
I begin by saying to all of you, on behalf of all of us, we thank you for the strength you have given to others even as you have borne your own grief, for we can see Ron in your eyes and hear him in your voices and feel his strength in yours. Indeed, I was confident, as I heard Michael speak, that from heaven Ron had written the words. So today and in all of our tomorrows, as we remember and love him, we will remember and love you. We hope on this day amidst all the grief you will also feel gratitude for his magnificent life, determination to carry on his legacy and keep it alive, and the peace of God which takes us to a place beyond all our understanding.
The Bible tells us, ""though we weep through the night, joy will come in the morning."" Ron Brown's incredible life force brought us all joy in the morning. No dark night could ever defeat him. And as we remember him, may we always be able to recover his joy. For this man loved life and all the things in it. He loved the big things: his family, his friends, his country, his work, his African-American heritage. He loved the difference he was making in the world, this new and exciting world after the cold war.
And he loved life's little things: the Redskins and basketball and golf, even when it was bad, and McDonald's and clothes. And I'm telling you, folks, he would have loved this deal today. I mean, here we are for Ron Brown in the National Cathedral with full military honors, filled with the distinguished citizenry of this country and leaders from around the world in a tribute to him. And as I look around, I see that all of us are dressed almost as well as he would be today. [ Laughter ]
But let us remember also that he loved success, but not so much he wanted to succeed at the wrong things or in the wrong way. And he always remembered that worldly success doesn't take us too very far from all the rest of our fellow human beings who don't enjoy as much of it. That accounts for why he was always so kind to people without regard to their station in life.
Ron Brown enjoyed a lot of success. He proved you could do well and do good. He also proved you could do good and have a good time. And he also proved that you could do all that and, at the same time, still take time to help other people.
With his passion and determination, his loves and his joys, his going beyond the stereotypes of his time, he lived a truly American life. He lived his life for America, and when the time came, he was found laying down his life for America.
What a life it was, with his remarkable enthusiasm that infected everything he did. As long as I live I will remember the time Ron Brown and I were walking the streets of the neighborhood in Los Angeles, and we went to this sporting goods store that had been owned by some people who were trying to help young folks stay out of gangs. And in the back of the sporting goods store, there was a basketball court. And all these little kids had gathered around, and they asked Ron and they asked me if we would like to play basketball. So we divided up sides. He took a few kids. I took a few kids. All of a sudden he forgot who was President and how he got his day job. [ Laughter ] He was totally caught up in the drama of the game. This was an important trip we took, but afterward, whenever anyone asked him about that trip, all he could remember to say was, ""The President was in my face from 20 feet out, but when I shot, nothing but net."" [ Laughter ]
Ron Brown was very clever. Even as a young boy at the Hotel Teresa, ""Little Brown,"" as Joe Louis called him, was always trying to think of what else could be done. He met all kinds of celebrities, as has been widely chronicled, men like Louis Armstrong and Sugar Ray Robinson and women like Lena Horne and Dinah Washington. And he did what most kids do, even today, he got their autographs. But unlike most kids, he sold them to his friends. [ Laughter ] According to Michael, he sold two to a page, five bucks a pop, until Joe Louis found out and shut down his act. [ Laughter ] But it was too late. He was well on his way to becoming the Secretary of Commerce. [ Laughter ]
He was daring. We all know that. He was daring when he announced he wanted to be the chairman of the Democratic Party, after we had lost three Presidential elections. And no one thought he had a chance to win. Then when he won, he announced that in 1992 the world's oldest political party would win the White House again. And nobody thought he was right, including the Governor of a small Southern State. [ Laughter ] But as with so many other things, he was right, and the rest of us were wrong.
On a personal note, I want to say to my friend just one last time: Thank you; if it weren't for you, I wouldn't be here.
Ron Brown was a true leader, and he knew that in his mind that meant you could never show doubt, even if you had to kind of make it up as you went along. I later learned this story about his acceptance of the job I offered him. I sent for Ron. He came to see me, and I said, ""You know, this is a big, new world out there, and you ought to be Secretary of Commerce. You could change the future of America and millions of other people around the world. You could make a real difference."" And he said, ""That sounds good. I want to think about it."" I later learned that he walked out and went to see our mutual friend Harold Ickes and said, ""Harold, what does the Secretary of Commerce do?"" [ Laughter ]
By the time he arrived, he knew. He knew better than anyone else. He came on like a force of nature. Yesterday I received a letter from one of the many business executives that Ron Brown helped to open new markets around the world. He's on our Export Council, and he said in this letter, ""You know, Mr. President, Ron Brown really is the finest Secretary of Commerce the United States ever had.""
He also remembered what it was he was leaning toward. Ron Brown made his staff memorize a one-sentence mission statement about their job at Commerce. Here it is: The mission of the Department of Commerce is to ensure economic opportunity for every American.
That was Ron. He wanted to give other people a chance to live a good life and live the American dream. He wanted to do it in a way that helped people around the world to lift their aspirations. He went after it with everything he had. He used to say to me, ""If what we have to do means getting the government out of the way, let's lead the charge. And if what we have to do means working together to find some new solution, let's lead the charge. But let's get it done. Let's fulfill the mission.""
He also never forgot that there are always some people who are left behind. I want to tell you this story because to me it captures so much the essence of what made him very special. When we first came into office we only had about a month to put our first budget together. And we knew we had to do some pretty tough things to get the deficit way down. Day after day, the Cabinet would gather in the Roosevelt Room; Ron was always there. And on one of those days, we talked about the need not only to cut the budget but to do some really symbolic things that would show the American people we were different and we stood for the right things. And we were all, frankly, being just a little sanctimonious in looking for symbolic gestures.
And so we were talking about the need to cut the perks that had previously been provided to top officials, things like chefs in the Secretary's dining room and chauffeurs for a lot of higher ranking officials. And we talked about them, frankly, all of us, nonchalantly and fairly sanctimoniously until Ron turned to me and said, ""You know, these cuts are the right thing to do, Mr. President. It is the right thing to do. But I'd just like to remind people that there are real human beings in those jobs as chefs and chauffeurs. A lot of those folks are my age. Many are black men. Most of them never had the opportunities you and I did. So let's go on and do the right things and make the cuts. But let's not forget about those people, and let's try to help them go on with their lives in dignity.""
No one else said that but Ron Brown. He could see where we had to go. He knew it was the right thing to do. But he had enough peripheral vision to know how other people were being affected.
That last thing I'd like to say about his remarkable public life is that while he was often determined to be first, he was equally determined that he would never be the last. And so he exerted more extraordinary effort than virtually anybody I've ever known to develop the talents of other people, to reach out to the young, to give them a chance to serve. How much of the weeping we have done this last week because there were so many brilliant young people on that plane with him from different backgrounds and different racial groups. Why? Because Ron Brown could see in them the promise of a new tomorrow, and he knew they needed someone to reach down and give them the opportunity to serve.
And I hope that is something that none of us will ever forget. For his legacy burns brightly not only in the lives of his wife and children and other family members but also all of those brilliant young men and women, many of whom are with us today, who walked through the doors that he opened and crossed over the bridges that he built.
I received a lot of letters and calls, like many of you have, since Ron died. I got this letter from Michael Armstrong, the chairman of Hughes Electronics, who was one of the people Ron worked with. And I wanted to read this to you, because so often we think Government operates in a vacuum. Listen to this:
""While the demands of business, the pressures of the Commerce Department, and the politics of Washington can often mask the spirit and character of the dedicated people who try so hard to make a difference for America, the business at hand, the pressures on the Department, and the politics of the moment never dimmed the smile, the energy, the commitment, and the leadership of the man who made such a big difference in the direction and destiny of our country. He led his party to the Presidency. He led the Commerce Department with imagination and distinction. He led American business to new global opportunity. He led his race as an unassuming but forceful role model. He led us all in being what he believed in. He was truly a leader.""
Ron Brown: a trailblazer, a builder, a patriot; a husband, a father, a wonderful friend, and a great American.
Let us remember these things about Ron. Let us always have our joy in the morning. Let us be determined to carry on his legacy. Let us always be vigilant, as he was, in fighting against any shred of racism and prejudice. Let us always be vigilant, as he was, in remembering that we cannot lift ourselves up by tearing other people down, that we have to go forward together. Let us always remember, as he did, that Alexis de Tocqueville was right when he said so many years ago, America is great because America is good. He knew we had to keep working and striving to be better.
In his last sermon from the pulpit, Martin Luther King asked God to grant us all a chance to be participants in the newness and magnificent development of America. That is the cause for which Ron Brown gave his life and the cause for which he gave up his life.
In his letter to the Galatians, St. Paul said, ""Let us not grow weary in doing good. For in due season we shall reap if we do not lose heart."" Our friend never grew weary; he never lost heart. He did so much good, and he is now reaping his reward. He left us sooner than we wanted him to leave, but what a legacy of love and life he left behind.
Now he's in a place where he doesn't even have to worry about how good he looks. He always will look good. He's in a place where there's always joy in the morning. He's in a place where every good quality he ever had has been rendered perfect. He's in a place he deserves to be because of the way he lived and what he left to those of us who loved him.
Let there always be joy in the morning for Ron Brown. Amen."
