date,title,url,president,text_category,full_text
"September 30, 2016",Remarks at a Memorial Service for Former President Shimon Peres of Israel in Jerusalem,https://www.presidency.ucsb.edu/documents/remarks-memorial-service-for-former-president-shimon-peres-israel-jerusalem,Barack Obama,eulogy,"Tzvia, Yoni, Chemi, and generations of the Peres family; President Rivlin; Prime Minister Netanyahu; members of the Israeli Government and the Knesset; heads of state and government; and guests from around the world, including President Abbas, whose presence here is a gesture and a reminder of the unfinished business of peace; to the people of Israel: I could not be more honored to be in Jerusalem to say farewell to my friend Shimon Peres, who showed us that justice and hope are at the heart of the Zionist idea.
A free life, in a homeland regained. A secure life, in a nation that can defend itself, by itself. A full life, in friendship with nations who can be counted on as allies, always. A bountiful life, driven by the simple pleasures of family and by big dreams. This was Shimon Peres's life. This is the State of Israel. This is the story of the Jewish people over the last century, and it was made possible by a founding generation that counts Shimon as one of its own.
Shimon once said that, ""The message of the Jewish people to mankind is that faith and moral vision can triumph over all adversity."" For Shimon, that moral vision was rooted in an honest reckoning of the world as it is. Born in the shtetl, he said he felt ""surrounded by a sea of thick and threatening forests."" When his family got the chance to go to Palestine, his beloved grandfather's parting words were simple: ""Shimon, stay a Jew."" Propelled with that faith, he found his home. He found his purpose. He found his life's work. But he was still a teenager when his grandfather was burned alive by the Nazis in the town where Shimon was born. The synagogue in which he prayed became an inferno. The railroad tracks that had carried him toward the Promised Land also delivered so many of his people to death camps.
And so from an early age, Shimon bore witness to the cruelty that human beings could inflict on each other, the ways that one group of people could dehumanize another; the particular madness of anti-Semitism, which has run like a stain through history. That understanding of man's ever-present sinfulness would steel him against hardship and make him vigilant against threats to Jewry around the world.
But that understanding would never harden his heart. It would never extinguish his faith. Instead, it broadened his moral imagination, and gave him the capacity to see all people as deserving of dignity and respect. It helped him see not just the world as it is, but the world as it should be.
What Shimon did to shape the story of Israel is well chronicled. Starting on the kibbutz he founded with his love Sonya, he began the work of building a model community. Ben-Gurion called him to serve the Haganah at headquarters to make sure that the Jewish people had the armaments and the organization to secure their freedom. After independence, surrounded by enemies who denied Israel's existence and sought to drive it into the sea, the child who had wanted to be a ""poet of stars"" became a man who built Israel's defense industry, who laid the foundation for the formidable armed forces that won Israel's wars. His skill secured Israel's strategic position. His boldness sent Israeli commandos to Entebbe and rescued Jews from Ethiopia. His statesmanship built an unbreakable bond with the United States of America and so many other countries. His contributions didn't end there. Shimon also showed what people can do when they harness reason and science to a common cause. He understood that a country without many natural resources could more than make up for it with the talents of its people. He made hard choices to roll back inflation and climb out from a terrible economic crisis. He championed the promise of science and technology to make the desert bloom and turned this tiny country into a central hub of the digital age, making life better not just for people here, but for people around the world.
Indeed, Shimon's contribution to this nation is so fundamental, so pervasive, that perhaps sometimes they can be overlooked. For a younger generation, Shimon was probably remembered more for a peace process that never reached its endpoint. They would listen to critics on the left who might argue that Shimon did not fully acknowledge the failings of his nation or perhaps more numerous critics on the right who argued that he refused to see the true wickedness of the world, and called him naive.
But whatever he shared with his family or his closest friends, to the world he brushed off the critics. And I know from my conversations with him that his pursuit of peace was never naive. Every Yom HaShoah, he read the names of the family that he lost. As a young man, he had fed his village by working in the fields during the day, but then defending it by carrying a rifle at night. He understood, in this war-torn region, where too often Arab youth are taught to hate Israel from an early age, he understood just how hard peace would be. I'm sure he was alternatively angry and bemused to hear the same critics, who called him hopelessly naive, depend on the defense architecture that he himself had helped to build.
I don't believe he was naive. But he understood from hard-earned experience that true security comes through making peace with your neighbors. ""We won them all,"" he said of Israel's wars. ""But we did not win the greatest victory that we aspired to: release from the need to win victories.""
And just as he understood the practical necessity of peace, Shimon believed that Israel's exceptionalism was rooted not only in fidelity to the Jewish people, but to the moral and ethical vision, the precepts of his Jewish faith. ""The Jewish people weren't born to rule another people,"" he would say. ""From the very first day we are against slaves and masters.""
Out of the hardships of the diaspora, he found room in his heart for others who suffered. He came to hate prejudice with the passion of one who knows how it feels to be its target. Even in the face of terrorist attacks, even after repeated disappointments at the negotiation table, he insisted that as human beings, Palestinians must be seen as equal in dignity to Jews, and must therefore be equal in self-determination. Because of his sense of justice, his analysis of Israel's security, his understanding of Israel's meaning, he believed that the Zionist idea would be best protected when Palestinians, too, had a state of their own.
Of course, we gather here in the knowledge that Shimon never saw his dream of peace fulfilled. The region is going through a chaotic time. Threats are ever present. And yet he did not stop dreaming, and he did not stop working. By the time that I came to work with Shimon, he was in the twilight of his years, although he might not admit it. I would be the 10th U.S. President since John F. Kennedy to sit down with Shimon; the 10th to fall prey to his charms. I think of him sitting in the Oval Office, this final member of Israel's founding generation, under the portrait of George Washington, telling me stories from the past, but more often talking with enthusiasm of the present: his most recent lecture, his next project, his plans for the future, the wonders of his grandchildren. In many ways, he reminded me of some other giants of the 20th century that I've had the honor to meet—men like Nelson Mandela; women like Her Majesty, Queen Elizabeth—leaders who have seen so much, whose lives span such momentous epochs, that they find no need to posture or traffic in what's popular in the moment; people who speak with depth and knowledge, not in sound bites. They find no interest in polls or fads.
And like these leaders, Shimon could be true to his convictions even if they cut against the grain of current opinion. He knew, better than the cynic, that if you look out over the arc of history, human beings should be filled not with fear but with hope. I'm sure that's why he was so excited about technology because for him, it symbolized the march of human progress. And it's why he loved so much to talk about young people, because he saw young people unburdened by the prejudices of the past. It's why he believed in miracles because in Israel, he saw a miracle come true.
As Americans and Israelis, we often talk about the unbreakable bonds between our nations. And, yes, these bonds encompass common interests—vital cooperation that makes both our nations more secure. But today, we are reminded that the bonds which matter most run deeper. Anchored in a Judeo-Christian tradition, we believe in the irreducible value of every human being. Our nations were built on that idea. They were built in large part by stubborn idealists and striving immigrants, including those who had fled war and fled oppression. Both our nations have flaws that we have not always fixed, corners of our history which date back to our founding that we do not always squarely address. But because our founders planted not just flags in the eternal soil, but also planted the seeds of democracy, we have the ability to always pursue a better world. We have the capacity to do what is right.
As an American, as a Christian, a person partly of African descent, born in Hawaii—a place that could not be further than where Shimon spent his youth—I took great pleasure in my friendship with this older, wiser man. We shared a love of words and books and history. And perhaps, like most politicians, we shared too great a joy in hearing ourselves talk. [ Laughter ] But beyond that, I think our friendship was rooted in the fact that I could somehow see myself in his story, and maybe he could see himself in mine. Because for all of our differences, both of us had lived such unlikely lives. It was so surprising to see the two of us where we had started, talking together in the White House, meeting here in Israel. And I think both of us understood that we were here only because in some way we reflected the magnificent story of our nations.
Shimon's story, the story of Israel, the experience of the Jewish people, I believe it is universal. It's the story of a people who, over so many centuries in the wilderness, never gave up on that basic human longing to return home. It's the story of a people who suffered the boot of oppression and the shutting of the gas chamber's door, and yet never gave up on a belief in goodness. And it's the story of a man who was counted on, and then often counted out, again and again, and who never lost hope.
Shimon Peres reminds us that the State of Israel, like the United States of America, was not built by cynics. We exist because people before us refused to be constrained by the past or the difficulties of the present. And Shimon Peres was never cynical. It is that faith, that optimism, that belief—even when all the evidence is to the contrary—that tomorrow can be better, that makes us not just honor Shimon Peres, but love him.
The last of the founding generation is now gone. Shimon accomplished enough things in his life for a thousand men. But he understood that it is better to live to the very end of his time on Earth with a longing not for the past, but for the dreams that have not yet come true: an Israel that is secure in a just and lasting peace with its neighbors. And so now this work is in the hand of Israel's next generation, in the hands of Israel's next generation and its friends.
Like Joshua, we feel the weight of responsibility that Shimon seemed to wear so lightly. But we draw strength from his example and the fact that he believed in us, even when we doubted ourselves.
Scripture tells us that before his death, Moses said, ""I call upon heaven and earth to bear witness this day that I have set before you life and death, blessing and curse; therefore choose life, that you and your offspring may live.""
Uvacharta Bachayim . Choose life. For Shimon, let us choose life, as he always did. Let us make his work our own. May God bless his memory. And may God bless this country, and this world, that he loved so dearly.
Shimon: Todah Rabah Chaver Yakar ."
"June 07, 2016",Eulogy at the Funeral Service for Former Deputy White House Counsel Cassandra Q. Butts,https://www.presidency.ucsb.edu/documents/eulogy-the-funeral-service-for-former-deputy-white-house-counsel-cassandra-q-butts,Barack Obama,eulogy,"The President. Good evening.
Audience members. Good evening.
The President. We are here to celebrate the life of our dear friend Cassandra, a warrior for social justice, a warm and generous servant who devoted her life to bettering the lives of others, and an unbelievable friend.
I first met Cassandra in a place that tends to stoke one's passions for social and economic justice: the financial aid line at law school. [ Laughter ] We were just entering Harvard Law. We happened to be next to each other in line, I think it was in Pound Hall, and we were furiously filling out our financial aid forms. I have no doubt I was doing something wrong. She may have looked over my shoulder and said, ""I think that's wrong."" [ Laughter ] And we were inching forward each time the registrar shouted, ""Next!"" We introduced ourselves to each other, and we bonded over the fact that we were signing our lives away to Harvard, fully aware of how long it would take us to pay off that debt that we were about to accrue.
And then, we bonded over other things. We bonded over our love for jazz. We bonded over our fandom of Michael Jordan, because she was a Tar Heel and I was a Bull. We talked about our early beginnings in civic engagement, protesting apartheid, her at North Carolina and me at Occidental. And we talked about our interest in the law, why we were there: the notion that we might somehow take this knowledge that we were going to extract from this place an apply it to help those on society's margins to improve their circumstances.
I made a lot of great friends at Harvard. Some of them are here today, like Judge Wilkins, who was older and cooler than I was at the time and still is. [ Laughter ] I don't know about older, but maybe still cooler. But Cassandra I relied on. I relied on her for counsel and for encouragement. I have a confession to make: I still possess some albums of hers. [ Laughter ] I think there's a Miles Davis album, a John Coltrane album. I've been listening to some of that music since she passed. In my defense, she kept one of my constitutional law books. [ Laughter ] But I think I got the better end of that trade. [ Laughter ]
And that was true generally with Cassandra. Those who knew her, I think, understood that somehow, we were getting the better end of that trade.
In law school, we'd sit around and dream about how we were going to take what we learned in those halls and we'd go change the world. And while we separated for a time after graduation—her coming to Washington, me heading back to Chicago—we stayed in touch. I kept up with her while she was working in Congress and at the NAACP Legal Defense Fund. I talked to her about the work I was doing as a civil rights attorney and a professor, and I told her about Michelle and all the hopes and dreams that we had together. And in a lot of ways, she served as a moral compass for me. She was a constant, steady presence.
And when I arrived here in Washington after winning my Senate race, I was 99th in seniority. But I did have a secret weapon, and that was, I knew Cassandra. [ Laughter ] So I asked her for some advice, and she, of course, went farther than that, helping me to hire a smart, dedicated team, helping me to get a conversation going with Pete Rouse, who had been the chief of staff for Tom Daschle and who had no reason to want to deal with somebody who was 99th in seniority. But somehow, she persuaded him to take a meeting with me, and as a consequence, we were able to put together this remarkable team of people, many of whom still work with me today.
She helped me to plan what I might accomplish on behalf of the people of Illinois. And then, because I thought that she didn't have enough to do, I'd send her early chapters of a book I was writing at 1:00 or 2:00 in the morning just to see what she thought. And we'd try to have dinner at least once a month, just to keep each other grounded, mainly for her to keep me grounded, because she didn't need help on that front.
I didn't know then that I'd run for President just a few short years later. But when I did, I knew that I needed her help. She was one of my most valuable utility players. She was like a Swiss Army knife: Whatever you needed, you could find. Smart enough to do just about any project, thoughtful enough to help others step in, finding those who might add to our collective efforts.
She was essential in the first days of my administration. Working with Greg Craig and others, she helped to stock our Justice Department with bright, dedicated attorneys. She meticulously crafted our earliest policies so that all who work in the White House hold ourselves to the highest of ethical standards as keepers of the public trust.
In fact, my first Executive orders, which she helped design, reflected both of our views that public service is a privilege, that it's not about advancing yourself or your friends or your clients or your donors or some ideological agenda, it's about advancing the interests of every single American: the pay freeze for senior staff, which made us very popular; the toughest lobbying ban in history; an ethics briefing on what's required of all of us to make sure that we're putting the people's interests above our own, a briefing, by the way, that I was the first person to receive. Each of those policies bore her touch.
And later, as my Deputy Counsel, Cassandra helped to oversee a range of areas, among them the vetting and selection of judicial nominees. And she did that pretty good, because she got one of the finest judges to agree to undergo a difficult process and become an outstanding Supreme Court justice.
But her most lasting impact, at least in my administration, was just being who she was.
Every senior White House appointee in those first days—every single one—had to meet personally with Cassandra. Every single one. That's how much trust I had in her, in her integrity, in her judgment, in her feel for people. She was the person I trusted to ensure that everybody we hired understood the values of this administration and approached their jobs with the kind of professionalism and decency and integrity expected of anyone fortunate enough to serve their country at the highest level.
She knew I wanted the best and the brightest, people with the same kind of high-minded idealism that she and I had talked about late into the night all those years before in law school, what we had imagined might be possible: that politics and government could be different; that this country could be better; that justice could be served, that it wasn't a pipe dream, that it wasn't something in the past, that it was something that could actually be achieved.
What better person to impart that message than Cassandra. What better person to impart upon each of us the notion that there's something bigger than ourselves and that when you give to others and you serve others and you do right by others, that that's what fills you up, that's what makes your life count.
Cassandra was one of those rare people you never wanted to disappoint, not because she was judgmental; she, in fact, was infinitely patient and forgiving of people's foibles. And she used that big, wonderful, deep laugh of hers to make you feel like, yes, everybody is going to make mistakes and everybody is going to screw up. So it wasn't because she was judgmental, it was because you felt somehow that she knew your best self, the person you couldn't always claim to be, but the person you hoped to be. She saw that in you. And I know she made me better, and I believe she made us better.
And if you've spoken to anybody who knew her well over these past several days or any of the innumerable people that she took the time to mentor, you'll hear the same qualities that we were looking for in those early days of the administration applied to her in spades: professionalism, decency, integrity, insight, smarts, humor, and a fundamental kindness. She was a kind person. You know, it's interesting, as you get older, it turns out, kindness counts for a lot.
It's been brought to my attention that, in her final months, Cassandra was working on a passion project: not fine-tuning the sports cars she loved to drive—[ laughter ]—but rather, funding scholarships for underprivileged high school kids who want to go to college to study the arts. And that came as no surprise. That's the kind of thing she'd do.
As a society, we have an unfortunate tendency to celebrate the people we love only once they are gone. So it is a testament to Cassandra, to the life that she lived and shared with us, that so many people celebrated her while she was still here. I do wish I had seen her more this past year. I know she would forgive me and smile and comfort me and tell me not to feel too guilty. Because that's who she was.
And I'd like to close my remarks on that note, by paraphrasing something that's stayed with me from a piece I read about her last week. It concluded by saying that Cassandra is survived by her mother, who lives in North Carolina; by her father, who lives in New York; by her sister, her brother-in-law, and her nephews, who she was so proud of, who live in Maryland; and her friends, who live everywhere. Her friends who live everywhere. How true that is.
She was my friend. She was as true a person as I ever met. I loved her dearly, and I will miss her badly.
We pray that the Lord grants our sister, Cassandra, eternal peace. May He bless her memory. May He bless her family and the lives of everyone that she touched."
