date,title,url,president,text_category,full_text
"February 07, 2006","Remarks at the Funeral Service for Coretta Scott King in Lithonia, Georgia",https://www.presidency.ucsb.edu/documents/remarks-the-funeral-service-for-coretta-scott-king-lithonia-georgia,George W. Bush,eulogy,"To the King Family, distinguished guests, and fellow citizens: We gather in God's house, in God's presence, to honor God's servant, Coretta Scott King. Her journey was long and only briefly with a hand to hold. But now she leans on everlasting arms. I've come today to offer the sympathy of our entire Nation at the passingof a woman who worked to make our Nation whole.
Americans knew her husband only as a young man. We knew Mrs. King in all the seasons of her life, and there was grace and beauty in every season. As a great movement of history took shape, her dignity was a daily rebuke to the pettiness and cruelty of segregation. When she wore a veil at 40 years old, her dignity revealed the deepest trust in God and His purposes. In decades of prominence, her dignity drew others to the unfinished work of justice. In all her years, Coretta Scott King showed that a person of conviction and strength could also be a beautiful soul. This kind and gentle woman became one of the most admired Americans of our time. She is rightly mourned, and she is deeply missed.
Some here today knew her as a girl and saw something very special long before a young preacher proposed. She once said, ""Before I was a King, I was a Scott."" And the Scotts were strong and righteous and brave in the face of wrong. Coretta eventually took on the duties of a pastor's wife and a calling that reached far beyond the doors of the Dexter Avenue Baptist Church.
In that calling, Dr. King's family was subjected to vicious words, threatening calls in the night, and a bombing at their house. Coretta had every right to count the cost and step back from the struggle. But she decided that her children needed more than a safe home; they needed an America that upheld their equality and wrote their rights into law. And because this young mother and father were not intimidated, millions of children they would never meet are now living in a better, more welcoming country.
In the critical hours of the civil rights movement, there were always men and women of conscience at the heart of the drama. They knew that old hatreds ran deep. They knew that nonviolence might be answered with violence. They knew that much established authority was against them. Yet they also knew that sheriffs and mayors and Governors were not ultimately in control of events, that a greater authority was interested and very much in charge. The God of Moses was not neutral about their captivity. The God of Isaiah and the prophets was still impatient with injustice. And they knew that the Son of God would never leave them or forsake them.
But some had to leave before their time, and Dr. King left behind a grieving widow and little children. Rarely has so much been asked of a pastor's wife, and rarely has so much been taken away. Years later, Mrs. King recalled, ""I would wake up in the morning, have my cry, then go in to them. The children saw me going forward.""
Martin Luther King, Jr., had preached that unmerited suffering could have redemptive power. Little did he know that this great truth would be proven in the life of the person he loved the most. Others could cause her sorrow, but no one could make her bitter. By going forward with a strong and forgiving heart, Coretta Scott King not only secured her husband's legacy, she built her own. Having loved a leader, she became a leader. And when she spoke, America listened closely, because her voice carried the wisdom and goodness of a life well lived.
In that life, Coretta Scott King knew danger; she knew injustice; she knew sudden and terrible grief. She also knew that her Redeemer lives. She trusted in the Name above every name. And today we trust that our sister Coretta is on the other shore—at peace, at rest, at home. May God bless you, and may God bless our country."
"September 07, 2005",Remarks at the Funeral Service for Chief Justice of the United States William H. Rehnquist,https://www.presidency.ucsb.edu/documents/remarks-the-funeral-service-for-chief-justice-the-united-states-william-h-rehnquist,George W. Bush,eulogy,"Jim and Janet and Nancy; members of the Rehnquist family; colleagues of the Chief Justice:
This afternoon the people of the United States mourn the passing of the leader of a branch of the Government, the eight Justices of the Court pay final homage to their Chief and friend, and a loving family bids farewell to a kind and gentle soul.
William Hubbs Rehnquist accomplished many things in his good life and rose to high places. And we remember the integrity and the sense of duty that he brought to every task before him. That character was clear in the young man of 18 who signed up for the Army Air Corps during the Second World War. The Nation saw that character in his more than three decades of service on our highest Court. And the Nation saw it again last January the 20th, when the Chief Justice made his way onto the Inaugural platform. Many will never forget the sight of this man, weakened by illness, rise to his full height and say in a strong voice, ""Raise your right hand, Mr. President, and repeat after me.""
It was more than a half-century ago that Bill Rehnquist first came to the Supreme Court as a law clerk. As he would later recount the story, he made that trip from Milwaukee in the middle of the winter in an old blue Studebaker with no heater. He recalled that as he began the journey, he patted that car and thought, ""Don't let me down, baby.""
After a year-and-a-half in the Chambers of Justice Robert Jackson, Bill Rehnquist left DC and headed for Phoenix with an even greater love for the law and with something more, a beautiful fiancee named Natalie Cornell. She would share his walk in life for nearly 40 years. All who knew the Chief know how he cherished Nan and their time together and how much he missed his wife in the years without her.
In every chapter of his life, William Rehnquist stood apart for his powerful intellect and clear convictions. In a profession that values disciplined thought and persuasive ability, a talent like his gets noticed in a hurry. Still in his forties, he became the 100th Justice of the Supreme Court, and one of the youngest in modern times.
After he moved to the center chair, William Rehnquist led the Court for nearly two decades and earned a place among our greatest chief justices. He built consensus through openness and collegiality. He was a distinguished scholar of the Constitution and a superb administrator of the judicial conference. He understood the role of a judge and the place of courts in our constitutional system. He was prudent in exercising judicial power and firm in defending judicial independence.
On the bench and as a leader of the Federal courts, Chief Justice Rehnquist was always a calm and steady presence. In his thinking and in his bearing, he personified the ideal of fairness, and people could sense it. Inside the Court, no man could have been a finer steward of the institution, its customs, and its history.
As long as William Rehnquist was presiding, colleagues and advocates knew that the proceedings would be orderly, on time, businesslike, and occasionally humorous. Once during an oral argument, a lawyer criticized his opponent's position by saying, ""I doubt very much it will fool this Court."" The Chief Justice replied, ""Don't overestimate us."" [ Laughter ]
In his time on the Court, William Rehnquist served with 16 other justices, and by all accounts, each one of his colleagues regarded the man with respect and affection. Justice William Brennen once said to a visitor, ""I cannot begin to tell you... how fond all of us are of him personally.""
Throughout this city of government, people saw William Rehnquist in that same way. He carried himself with dignity but without pretense. Like Ronald Reagan, the President who elevated him to Chief Justice, he was kindly and decent, and there was not an ounce of self-importance about him. It is rare that—it is a rare man who can hold a prominent position in Washington, DC, for more than 30 years and leave behind only good feelings and admiration. That's what William Rehnquist did.
His law clerks knew him as a demanding boss who pressed them, as one said, to ""read carefully, write clearly, and to think hard."" But the clerks also became an extension of the Chief's family, joining him for walks around the Capitol, or for lunch or dinner, or games of tennis or charades. His clerks remember those times with fondness. And even more, they remember his vast store of knowledge and his daily example of clear thinking and character. To work beside William Rehnquist was to learn how a wise man looks at the law and how a good man looks at life.
The Chief Justice was devoted to his public duties but not consumed by them. He was a renaissance man, a man who adored his family, a man who always kept things in balance. He read works of history and wrote a few fine ones of his own. He knew how to paint, and he knew how to win at bridge and poker. He had a passion for the classics, for astronomy, and for college basketball. He enjoyed music, and having stood next to him during the national anthem, I can tell you the man loved to sing. [ Laughter ]
William Rehnquist often reminded young lawyers of the ancient insight that time is the most valuable thing a man can spend. He spoke with feeling about the need to choose wisely, doing your job well, and never forgetting the other important things that also take time: love for one another, being a good parent to a child, service to your community. He might have added, the importance of being a loving grandfather, because he was clearly that too.
The 16th Chief Justice of the United States was given 80 years of life. He filled those years with purpose, a gracious spirit, and faithful service to God and country to the very end. He now goes to his rest beside his beloved Nan. And William H. Rehnquist leaves behind the gratitude of our whole Nation. We're proud of our Chief Justice, and America honors his memory. May God bless him."
"June 11, 2004",Eulogy at the National Funeral Service for President Ronald Reagan,https://www.presidency.ucsb.edu/documents/eulogy-the-national-funeral-service-for-president-ronald-reagan,George W. Bush,eulogy,"Mrs. Reagan, Patti, Michael, and Ron; members of the Reagan family; distinguished guests, including our Presidents and First Ladies; Reverend Danforth; fellow citizens:
We lost Ronald Reagan only days ago, but we have missed him for a long time. We have missed his kindly presence, that reassuring voice, and the happy ending we had wished for him. It has been 10 years since he said his own farewell, yet it is still very sad and hard to let him go. Ronald Reagan belongs to the ages now, but we preferred it when he belonged to us.
In a life of good fortune, he valued above all the gracious gift of his wife, Nancy. During his career, Ronald Reagan passed through a thousand crowded places, but there was only one person, he said, who could make him lonely by just leaving the room.
America honors you, Nancy, for the loyalty and love you gave this man on a wonderful journey and to that journey's end. Today our whole Nation grieves with you and your family.
When the sun sets tonight off the coast of California and we lay to rest our 40th President, a great American story will close. The second son of Nelle and Jack Reagan first knew the world as a place of open plains, quiet streets, gas-lit rooms, and carriages drawn by horse. If you could go back to the Dixon, Illinois, of 1922, you'd find a boy of 11 reading adventure stories at the public library or running with his brother, Neil, along Rock River and coming home to a little house on Hennepin Avenue. That town was the kind of place you remember where you prayed side by side with your neighbors, and if things were going wrong for them, you prayed for them and knew they'd pray for you if things went wrong for you.
The Reagan family would see its share of hardship, struggle, and uncertainty. And out of that circumstance came a young man of steadiness, calm, and a cheerful confidence that life would bring good things. The qualities all of us have seen in Ronald Reagan were first spotted 70 and 80 years ago. As the lifeguard in Lowell Park, he was the protector keeping an eye out for trouble. As a sports announcer on the radio, he was the friendly voice that made you see the game as he did. As an actor, he was the handsome, all-American good guy, which in his case required knowing his lines—and being himself.
Along the way, certain convictions were formed and fixed in the man. Ronald Reagan believed that everything happens for a reason and that we should strive to know and do the will of God. He believed that the gentleman always does the kindest thing. He believed that people were basically good and had the right to be free. He believed that bigotry and prejudice were the worst things a person could be guilty of. He believed in the Golden Rule and in the power of prayer. He believed that America was not just a place in the world but the hope of the world.
And he believed in taking a break now and then, because, as he said, ""There's nothing better for the inside of a man than the outside of a horse.""
Ronald Reagan spent decades in the film industry and in politics, fields known on occasion to change a man—but not this man. From Dixon to Des Moines to Hollywood to Sacramento to Washington, DC, all who met him remembered the same sincere, honest, upright fellow. Ronald Reagan's deepest beliefs never had much to do with fashion or convenience. His convictions were always politely stated, affably argued, and as firm and straight as the columns of this cathedral.
There came a point in Ronald Reagan's film career when people started seeing a future beyond the movies. The actor Robert Cummings recalled one occasion. ""I was sitting around the set with all these people, and we were listening to Ronnie, quite absorbed. I said, 'Ron, have you ever considered someday becoming President?' He said, 'President of what?' 'President of the United States,' I said. And he said, 'What's the matter, don't you like my acting either?""' [ Laughter ]
The clarity and intensity of Ronald Reagan's convictions led to speaking engagements around the country and a new following he did not seek or expect. He often began his speeches by saying, ""I'm going to talk about controversial things."" And then he spoke of communist rulers as slavemasters, of a Government in Washington that had far overstepped its proper limits, of a time for choosing that was drawing near. In the space of a few years, he took ideas and principles that were mainly found in journals and books and turned them into a broad, hopeful movement ready to govern.
As soon as Ronald Reagan became California's Governor, observers saw a star in the West, tanned, well-tailored, in command, and on his way. In the 1960s, his friend Bill Buckley wrote, ""Reagan is indisputably a part of America, and he may become a part of American history.""
Ronald Reagan's moment arrived in 1980. He came out ahead of some very good men, including one from Plains and one from Houston. What followed was one of the decisive decades of the century, as the convictions that shaped the President began to shape the times.
He came to office with great hopes for America and more than hopes. Like the President he had revered and once saw in person, Franklin Roosevelt, Ronald Reagan matched an optimistic temperament with bold, persistent action. President Reagan was optimistic about the great promise of economic reform, and he acted to restore the rewards and spirit of enterprise. He was optimistic that a strong America could advance the peace, and he acted to build the strength that mission required. He was optimistic that liberty would thrive wherever it was planted, and he acted to defend liberty wherever it was threatened.
And Ronald Reagan believed in the power of truth in the conduct of world affairs. When he saw evil camped across the horizon, he called that evil by its name. There were no doubters in the prisons and gulags where dissidents spread the news, tapping to each other in code what the American President had dared to say. There were no doubters in the shipyards and churches and secret labor meetings where brave men and women began to hear the creaking and rumbling of a collapsing empire. And there were no doubters among those who swung hammers at the hated wall that the first and hardest blow had been struck by President Ronald Reagan.
The ideology he opposed throughout his political life insisted that history was moved by impersonal tides and unalterable fates. Ronald Reagan believed instead in the courage and triumph of free men, and we believe it all the more because we saw that courage in him.
As he showed what a President should be, he also showed us what a man should be. Ronald Reagan carried himself, even in the most powerful office, with a decency and attention to small kindnesses that also defined a good life. He was a courtly, gentle, and considerate man, never known to slight or embarrass others.
Many people across the country cherish letters he wrote in his own hand to family members on important occasions, to old friends dealing with sickness and loss, to strangers with questions about his days in Hollywood. A boy once wrote to him requesting Federal assistance to help clean up his bedroom. [ Laughter ] The President replied that, ""Unfortunately, funds are dangerously low."" [ Laughter ] He continued, ""I'm sure your mother was fully justified in proclaiming your room a disaster. Therefore, you are in an excellent position to launch another volunteer program in our Nation. Congratulations."" [ Laughter ]
See, our 40th President wore his title lightly, and it fit like a white Stetson. In the end, through his belief in our country and his love for our country, he became an enduring symbol of our country. We think of his steady stride, that tilt of the head and snap of the salute, the big-screen smile, and the glint in his Irish eyes when a story came to mind.
We think of a man advancing in years with the sweetness and sincerity of a Scout saying the Pledge. We think of that grave expression that sometimes came over his face, the seriousness of a man angered by injustice and frightened by nothing. We know, as he always said, that America's best days are ahead of us, but with Ronald Reagan's passing, some very fine days are behind us, and that is worth our tears.
Americans saw death approach Ronald Reagan twice, in a moment of violence and then in the years of departing light. He met both with courage and grace. In these trials, he showed how a man so enchanted by life can be at peace with life's end.
And where does that strength come from? Where is that courage learned? It is the faith of a boy who read the Bible with his mom. It is the faith of a man lying in an operating room who prayed for the one who shot him before he prayed for himself. It is the faith of a man with a fearful illness who waited on the Lord to call him home.
Now death has done all that death can do. And as Ronald Wilson Reagan goes his way, we are left with the joyful hope he shared. In his last years, he saw through a glass darkly. Now he sees his Savior face to face.
And we look for that fine day when we will see him again, all weariness gone, clear of mind, strong and sure and smiling again, and the sorrow of this parting gone forever.
May God bless Ronald Reagan and the country he loved."
"February 04, 2003","Remarks at a Memorial Service for the STS-107 Crew of the Space Shuttle Columbia in Houston, Texas",https://www.presidency.ucsb.edu/documents/remarks-memorial-service-for-the-sts-107-crew-the-space-shuttle-columbia-houston-texas,George W. Bush,eulogy,"Their mission was almost complete, and we lost them so close to home. The men and women of the Columbia had journeyed more than 6 million miles and were minutes away from arrival and reunion.
The loss was sudden and terrible, and for their families, the grief is heavy. Our Nation shares in your sorrow and in your pride, and today we remember not only one moment of tragedy but seven lives of great purpose and achievement.
To leave behind Earth and air and gravity is an ancient dream of humanity. For these seven, it was a dream fulfilled. Each of these astronauts had the daring and discipline required of their calling. Each of them knew that great endeavors are inseparable from great risks, and each of them accepted those risks willingly, even joyfully, in the cause of discovery.
Rick Husband was a boy of 4 when he first thought of being an astronaut. As a man, and having become an astronaut, he found it was even more important to love his family and serve his Lord. One of Rick's favorite hymns was ""How Great Thou Art,"" which offers these words of praise: ""I see the stars. I hear the mighty thunder. Thy power throughout the universe displayed.""
David Brown was first drawn to the stars as a little boy with a telescope in his backyard. He admired astronauts, but, as he said, ""I thought they were movie stars. I thought I was kind of a normal kid."" David grew up to be a physician, an aviator who could land on the deck of a carrier in the middle of the night, and a shuttle astronaut. His brother asked him several weeks ago what would happen if something went wrong on their mission. David replied, ""This program will go on.""
Michael Anderson always wanted to fly planes and rose to the rank of lieutenant colonel in the Air Force. Along the way, he became a role model, especially for his two daughters and for the many children he spoke to in schools. He said to them, ""Whatever you want to be in life, you're training for it now."" He also told his minister, ""If this thing doesn't come out right, don't worry about me. I'm just going on higher.""
Laurel Salton Clark was a physician and a flight surgeon who loved adventure, loved her work, loved her husband and her son. A friend who heard Laurel speaking to Mission Control said, ""There was a smile in her voice."" Laurel conducted some of the experiments as Columbia orbited the Earth and described seeing new life emerge from a tiny cocoon. ""Life,"" she said, ""continues in a lot of places, and life is a magical thing.""
None of our astronauts traveled a longer path to space than Kalpana Chawla. She left India as a student, but she would see the nation of her birth, all of it, from hundreds of miles above. When the sad news reached her hometown, an administrator at her high school recalled, ""She always said she wanted to reach the stars. She went there, and beyond."" Kalpana's native country mourns her today, and so does her adopted land.
Ilan Ramon also flew above his home, the land of Israel. He said, ""The quiet that envelops space makes the beauty even more powerful, and I only hope that the quiet can one day spread to my country."" Ilan was a patriot; the devoted son of a Holocaust survivor served his country in two wars. ""Ilan,"" said his wife, Rona, ""left us at his peak moment, in his favorite place, with people he loved.""
The Columbia's pilot was Commander Willie McCool, whom friends knew as the most steady and dependable of men. In Lubbock today they're thinking back to the Eagle Scout who became a distinguished naval officer and a fearless test pilot. One friend remembers Willie this way: ""He was blessed, and we were blessed to know him.""
Our whole Nation was blessed to have such men and women serving in our space program. Their loss is deeply felt, especially in this place, where so many of you called them friends. The people of NASA are being tested once again. In your grief, you are responding as your friends would have wished, with focus, professionalism, and unbroken faith in the mission of this agency.
Captain Brown was correct: America's space program will go on.
This cause of exploration and discovery is not an option we choose. It is a desire written in the human heart. We are that part of creation which seeks to understand all creation. We find the best among us, send them forth into unmapped darkness, and pray they will return. They go in peace for all mankind, and all mankind is in their debt.
Yet, some explorers do not return, and the loss settles unfairly on a few. The families here today shared in the courage of those they loved, but now they must face life and grief without them. The sorrow is lonely, but you are not alone. In time, you will find comfort and the grace to see you through. And in God's own time, we can pray that the day of your reunion will come.
And to the children who miss your mom or dad so much today, you need to know they love you and that love will always be with you. They were proud of you, and you can be proud of them for the rest of your life.
The final days of their own lives were spent looking down upon this Earth. And now, on every continent, in every land they could see, the names of these astronauts are known and remembered. They will always have an honored place in the memory of this country. And today I offer the respect and gratitude of the people of the United States.
May God bless you all."
