date,title,url,president,text_category,full_text
"September 21, 2025","Remarks at a Memorial Service for Charlie Kirk in Glendale, Arizona",https://www.presidency.ucsb.edu/documents/remarks-memorial-service-for-charlie-kirk-glendale-arizona,Donald J. Trump (2nd Term),eulogy,"Unlike previous administrations, the White House is not distributing transcripts. The APP will post the transcript of these remarks when they are published in the Daily Compilation of Presidential Documents . The DCPD provides these transcripts approximately six weeks following the event."
"January 09, 2025",Eulogy at a Memorial Service for Former President Jimmy Carter,https://www.presidency.ucsb.edu/documents/eulogy-memorial-service-for-former-president-jimmy-carter,"Joseph R. Biden, Jr.",eulogy,"Leaders of the clergy; distinguished guests; most importantly, the Carter family:
In April 2021, Jill and I visited Jimmy and Rosalynn on a warm spring day down in Plains, Georgia. We wanted to see them.
Rosalynn met us at the front door with her signature smile. Together, we entered a home that they had shared for almost 77 years of marriage, an unassuming red-brick ranch home that reflects their modesty more than any trappings of power.
We walked in the living room, where Jimmy greeted us like family. That day, just the four of us sat in the living room and shared memories that spanned almost six decades. A deep friendship that started in 1974.
I was a 31-year-old Senator, and I was the first Senator outside of Georgia—I—maybe the first Senator—to endorse his candidacy for President. It was an endorsement based on what I believe is Jimmy Carter's enduring attribute: character. Character. Character.
Because of that—character, I believe, is destiny—destiny in our lives and, quite frankly, destiny in the life of the Nation. It's an accumulation of a million things built on character that leads to a good life and a decent country: a life of purpose, a life of meaning.
Now, how do we find that good life? What does it look like? What does it take to build character? Do the ends justify the means?
Jimmy Carter's friendship taught me—and, through his life, taught me that strength of character is more than title or the power we hold. It's the strength to understand that everyone should be treated with dignity, respect; that everyone—and I mean everyone—deserves an even shot, not a guarantee, but just a shot.
You know, we have an obligation to give hate no safe harbor and to stand up to what my dad used to say is the greatest sin of all: the abuse of power.
And that's not about being perfect because none of us are perfect. We're all fallible. But it's about asking ourselves: Are we striving to do things—the right things? What values—what are the values that animate our spirit? Do we operate from fear or hope, ego or generosity? Do we show grace? Do we keep the faith when it's most tested?
For keeping the faith with the best of humankind and the best of America is a story, in my view, from my perspective, of Jimmy Carter's life. A story of a man—to state the obvious, you've heard today some great, great eulogies—who came from a house without running water or electricity and rose to the pinnacle of power. A story of a man who was at once driven and devoted to making real the words of his Savior and the ideals of this Nation. A story of a man who never let the tides of politics divert him from his mission to serve and shape the world.
The man had character. Jimmy held a deep Christian faith in God and that his candidacy spoke and wrote about. Faith as a substance of things hoped for and evidence of the things not seen. Faith founded on commandments of Scripture: Love the Lord thy God with all thy heart and all thy mind and all thy soul and love thy neighbor as thyself. Easy to say, but very, very difficult to do.
In his life—in this life, any walk of faith can be difficult. It can be lonely. But it requires action to be the doers of the world.
But in that commandment lies the essence, in my view, found in the Gospel, found in many faith traditions, and found in the very idea of America. Because the very journey of our Nation is a walk of sheer faith to do the work, to be the country we say we are, to be the country we say we want to be. A nation where all are created equal in the image of God and deserve to be treated equally throughout our lives.
We've never fully lived up to that idea of America. But we've never walked away from it either, because of patriots like Jimmy Carter.
Throughout his life, he showed us what it means to be a practitioner of good works and a good and faithful servant of God and of the people.
And today, many think he was from a bygone era. But, in reality, he saw well into the future. A White Southern Baptist who led on civil rights. A decorated Navy veteran who brokered peace. A brilliant nuclear engineer who led on nuclear nonproliferation. A hard-working farmer who championed conservation and clean energy. And a President who redefined the relationship with the Vice President.
Jimmy and I often talked about our dear friend Walter Mondale, whom we all miss very much. Together, they formed a model partnership of collaboration and trust, as both were men of character.
And as we all know, Jimmy Carter also established a model post-Presidency by making a powerful difference as a private citizen in America and, I might add, as you all know, around the world.
Through it all, he showed us how character and faith start with ourselves and then flows to others. At our best, we share the better parts of ourselves: joy, solidarity, love, commitment—not for reward, but in reverence for the incredible gift of life we've all been granted.
To make every minute of our time here on Earth count, that's the definition of a good life, a life Jimmy Carter lived during his 100 years. To young people, to anyone in search of meaning and purpose, study the power of Jimmy Carter's example.
I miss him, but I take solace in knowing that he and his beloved Rosalynn are reunited again.
And to the entire Carter family, thank you—and I mean this sincerely—for sharing them both with America and the world. We love you all.
Jill and I will cherish our visits with them, including that last one in their home. We saw Jimmy as he always was: at peace, with a life fully lived. A good life of purpose and meaning, of character, driven by destiny and filled with the power of faith, hope, and love. I'll say it again: faith, hope and love.
As he returned to Plains, Georgia, for his final resting place, we can say goodbye. In the words of the prophet Micah, who Jimmy so admired until his final breath, Jimmy Carter did justly, loved mercy, walked humbly.
May God bless a great American and a dear friend and a good man. May he rise up—be raised up on eagle's wings and bear you on the breath of dawn and make you to shine like the Sun and hold you in the palm of His hand.
God bless you, Jimmy Carter."
"January 07, 2025",Remarks by the Vice President at the Lying in State Ceremony for Former President Jimmy Carter,https://www.presidency.ucsb.edu/documents/remarks-the-vice-president-the-lying-state-ceremony-for-former-president-jimmy-carter,Kamala Harris,eulogy,"THE VICE PRESIDENT: Leader Thune, Speaker Johnson, Leader Schumer, Leader Jeffries, members of Congress, and distinguished guests, it is an honor to be with you this afternoon.
And to Jack, Chip, Jeff, Amy, and Jason and all the other members of the Carter family, on behalf of the American people, Doug and I offer our deepest condolences.
Being with you today, I am reminded of the enduring words of a favorite hymn: May the works I have done speak for me.
Today, we gather to celebrate the life of a man whose works will echo for generations to come, a man from Plains, Georgia, who grew up without electricity or running water and served as the 39th president of the United States of America and lived every day of his long life in service to the people: President James Earl Carter, Jr.
So, I was in middle school when Jimmy Carter was elected president, and I vividly recall how my mother admired him, how much she admired his strength of character, his honesty, his integrity, his work ethic and determination, his intelligence, and his generosity of spirit.
We have heard much today and in recent days about President Carter's impact in the four decades after he left the White House. Rightly so. Jimmy Carter established a new model for what it means to be a former president and leaves an extraordinary post-presidential legacy, from founding the Carter Center, which has helped advance global human rights and alleviate human suffering, to his public health work in Latin America and Africa, to his tireless advocacy for peace and democracy around the globe.
And Jimmy Carter was a president of the United States who was ahead of his time. He was the first president of the United States to have a comprehensive energy policy, including providing some of the first federal support for clean energy. He also passed over a dozen major pieces of legislation regarding environmental protection and more than doubled the size of America's national parks, including protecting our beloved Redwoods in my home state of California.
He was a president who, between the years of 1977 and 1981, appointed more Black Americans to the federal bench than all of his predecessors combined and appointed five times as many women. And in the wake of Watergate, Jimmy Carter passed historic ethics legislation to help rebuild America's faith in government.
Jimmy Carter, as president, was also a respected global leader. To be sure, the years of his presidency were not without international crises or challenges, but his legacy of global leadership is well established.
In Asia, he instituted full diplomatic relations with China, which he would later call one of the most historically significant accomplishments of his presidency.
And his legacy lives on in the Middle East, because do recall in the decades before Jimmy Carter became president, Israel and Egypt had been at war numerous times. Few thought peace could be achieved between them. Yet Jimmy Carter did that. Through his persistence and perseverance, through his unshakable belief in the power of American diplomacy, he secured the Camp David Accords, one of the most significant and durable peace treaties since World War II.
And throughout the world, Jimmy Carter elevated the role of human rights in America's foreign policy priorities and uplifted the importance of civil society in doing that work.
Jimmy Carter was a forward-looking president with a vision for the future. Consider his establishment of the Department of Energy in 1977, which anticipated the central role it would play in addressing the climate crisis; his creation of FEMA in 1979, which enabled our nation to mobilize a national response to disasters which has helped countless communities rebuild and recover; and his founding of the Department of Education later that year, which elevated public education institutions and increased national standards for the education of America's children and future leaders.
Jimmy Carter was that all-too-rare example of a gifted man who also walks with humility, modesty, and grace. Recall the stories from the 1976 campaign about how he slept in the homes of his supporters to share a meal with them at their table and to listen to what was on their minds.
How, on their first trip for Habitat for Humanity, Jimmy and Rosalynn rode the bus with the other volunteers. And when the group stopped for the night to stay at a local church, Jimmy and Rosalynn gave their private room to a young couple who had put off their honeymoon to join the trip. And with the other volunteers, they then slept on the floor of the church basement.
And then, of course, his work to eradicate the vicious Guinea worm disease that once disabled millions of people a year. It was one of the Carter Center's greatest triumphs. And Jimmy Carter, of course, given his nature, attributed its success not to his own leadership but to the thousands of everyday Africans who were on the ground doing the work.
Throughout his life and career, Jimmy Carter retained a fundamental decency and humility. James Earl Carter, Jr., loved our country. He lived his faith, he served the people, and he left the world better than he found it.
And in the end, Jimmy Carter's work and those works speak for him louder than any tribute we can offer.
May his life be a lesson for the ages and a beacon for the future.
May God bless President Jimmy Carter. And may God bless the United States of America."
"October 16, 2024",Eulogy at a Memorial Service for Ethel Kennedy,https://www.presidency.ucsb.edu/documents/eulogy-memorial-service-for-ethel-kennedy,"Joseph R. Biden, Jr.",eulogy,"Hello.
Joe, thank you.
Thank you, thank you, thank you.
I'm sure you're clapping because I'm the last speaker.
Well, that was worth that partial comment—or concert. You know what he said on the way out? Can I tell them, pal? He said, ""If I get a Grammy, I'm going to give it to you,"" the only guy in this whole darn church who can't sing a note. [ Laughter ]
My dad used to have a band and sang. He said: ""Joey, I don't know where the hell you came from. You can't carry a tune. You can't sing. You can't dance. I don't know where you came from, but I love you anyway."" [ Laughter ]
Father MacMillan, thank you for everything. Thank you for being so good to us.
President Clinton, President Obama, distinguished guests; the Kennedy family, children and grandchildren, great-grandchildren, and extended family: It's been an emotional journey listening to all of you. When I knew I was going to be the last speaker, I thought, ""How did that happen?"" Because, you know, it brings back so many memories.
Ethel was always there for so many people, and she played an essential role in my life as well—maybe a little different than with others. She was there as soon as I entered political office in 1972 as a 29-year-old kid before I got sworn in.
I was in her brother-in-law's office, Teddy's office, hiring staff—I was only 29; you had to be 30 years old to be sworn in, and I wasn't 30 yet—when I got a phone call from the fire department in my—by my house saying there had been an accident. A tractor-trailer had broadsided my wife's automobile, Christmas shopping with a Christmas tree on top, on December 18, and killed my wife and killed my daughter, and my boys weren't expected to live.
When I lost my family—and she was there. Joe, your mom was there then—then.
As soon as I got elected President, I received a letter from your mom. The letterhead was titled Mrs. Robert Kennedy, and in her very neat handwriting, she had written that she took great comfort in knowing the country was in good hands.
She had no idea, for a 29-year-old kid in that circumstance, how much it meant. Because, as some of you know—Bill knows—I didn't plan on sticking around after that accident.
She said she was honored and proud there was a bust of her husband, Bobby Kennedy, in my office, the Oval Office.
I have only two political heroes in my life: Dr. King and Bobby Kennedy. Not a joke. So I didn't realize—my two colleagues from the—who were President know—you get to pick what you want in your office, and I wanted to be able to see both of them from my—from the Resolute Desk by the fireplace: Dr. King and Bobby Kennedy.
And, days later, I received another letter from her that I'll always remember, and I know all of you look forward to each year: a valentine card—a valentine card. Which, in our house, Valentine's Day is known as ""Jill's holiday."" [ Laughter ]
Like Ethel, Jill is a practical joker. So it was no surprise—it was no surprise that Jill loved Ethel's card that year, which said—I'm not sure the hundred others who receive it felt the same way because, apparently, she sent that card—she sent it to everyone that year. [ Laughter ] It was a picture of me and Ethel surrounded by hearts. [ Laughter ] Oh, you think I'm kidding. I—it meant a lot to me, I'm telling you.
Printed—the language on the card, it said—in the printed language of the card, it said, ""I'm not Biden my time waiting for you, Valentine."" [ Laughter ] And then in her handwriting, she says, ""'Cause he's no ordinary Joe."" [ Laughter ]
I don't know how many of you got that damn valentine, but I tell you what, it meant a lot to me. [ Laughter ] I've received a lot of honors in my life, but that might be the best one I've ever received. [ Laughter ]
You know, yes, Ethel was Mrs. Robert Kennedy. She was one of my political—he was my—as I said, one of my political heroes. But I always knew her as Ethel Kennedy, a hero in her own right. I loved Bobby Kennedy. I've only met him once when I was in Syracuse law school and he was campaigning. But I just—I admired him so damn much.
I've told John Kerry this, my buddy. I could picture Bobby at my kitchen table with my dad and my mom. I could picture him there.
But you know, Ethel was a hero in her own right, full of character, full of integrity and empathy—and genuine empathy. She was full of laughter and joy and light. She was a great athlete in her own right, for real. She was a mother. Literally, there was nothing, from my perspective and, I suspect, most of you, that she couldn't do—nothing.
Four years later, after I had gotten—after Bobby—she lost her beloved Bobby, she invited me and my boys to her home after the accident left my family broken, having lost my wife and daughter, my boys barely making it. Along with Teddy, she got me through a time I didn't want to stick around. I wanted no part of being in the Congress or the Senate. I mean it.
I'd spoken to my Governor, because we had elected a Democratic Governor, to find a replacement for me. But Teddy and Ethel Kennedy would hear nothing—none of it. You know, the fact is, like she did for the country, Ethel helped my family find a way forward with principle and purpose.
We saw how she picked up Bobby's cause and stamped her own mark on the country. Marching for civil rights, as you heard about today, and working to end poverty at home, attempting to secure peace abroad, and so much more. She once said: ""For anyone to achieve something, you have to show a little courage. You're only on this Earth once. You must give it all you've got.""
Reminded me of my mom. My mom used to say: ""Joey, courage lives in every heart, and one day you'll be called upon. Be ready to stand up."" And that's not—that's from Catherine Eugenia Finnegan Biden, and she meant it. She meant it.
For over 50 years, with Ethel's own iron will and moral courage, she gave it everything she had, and we're a better nation and a better world because of Ethel Kennedy.
Let me close with this. On a Sunday in May this year, I delivered a commencement speech at Morehouse College in Atlanta. I noted that had we been in church that day, there'd be a reflection about the Resurrection and redemption. We remember Jesus was buried on Friday, and on Sunday, He rose again. But we don't talk nearly enough about that Saturday when His disciples felt all hope was lost—all hope was lost.
In our lives and in the life of our Nation, we have those Saturdays—and thank God your mom, your grandmom, your great-grandmom was there for me—to bear witness to the day before glory, to see people's pain and not look away. But work is to be done on Saturday, is to move pain to purpose. How can faith get a person, get a nation through what is coming?
Well, my message to all of us here today and to the entire the country is, look to Ethel Kennedy's faith.
To the Kennedy family—presumptuous of me to say this and maybe sound inappropriate, but to the Kennedy family, the Biden family is here for you, as you've always been for us. You changed the life of my boys. You really did.
When I lost my son Beau, he was attorney general of the State of Delaware. And he volunteered to join the National Guard as attorney general. You either have to be State property or Federal property. And he temporarily gave up his office to go with his unit for a year in Iraq. And unfortunately, I was in—in out—in and out of Iraq, as Barack knows, because—and Afghanistan 30-some times. And I got to see him several times.
But the bad news was he was about a quarter to a half mile away from a burn pit—100 yards long, 10 feet deep, burning everything from waste to—everything, poisoning the air. And he came home with stage 4 glioblastoma, and he died. Your mom was there then too.
I apologize.
So, from the Biden family to the Kennedy family, the hymn that's very close to our heart based on the 91st Psalm, it goes like this: ""May he raise you up on eagle's wings and bear you on the breath of dawn, and make you to shine like the Sun, and hold you in the palm of his hand.""
May God bless Ethel Kennedy, and may we—she—may be—she be reunited with the blessed pieces of her soul in Heaven.
God bless you all, and thank you for letting me participate. Thank you."
